{
  "schemaRevision": 1,
  "runnerRevision": 2,
  "matrixRevision": 1,
  "measurementClass": "controlled-runner-baseline-candidate",
  "baselineEligible": true,
  "lifecycle": "cold-end-to-end",
  "warmMeasurementsPresent": false,
  "warmExclusionReason": "Stock/pinned MARS CLI has no verified persistent process with complete case-state reset; no MARS result may be labeled warm.",
  "runner": {
    "id": "github-hosted:ubuntu-24.04",
    "imageVersion": "ubuntu24:20260823.283.1",
    "cpuPolicy": "github-managed;governor=github-managed-unavailable",
    "concurrency": 1,
    "platform": "linux",
    "arch": "x64",
    "cpuModel": "AMD EPYC 7763 64-Core Processor",
    "logicalCpuCount": 4,
    "totalMemoryBytes": 16766414848,
    "nodeVersion": "v24.19.0",
    "javaVersion": "openjdk version \"25.0.4.1\" 2026-08-18 LTS",
    "ci": {
      "provider": "github-actions",
      "repository": "stone926/BUAA-CO-Toolkit",
      "workflowRef": "stone926/BUAA-CO-Toolkit/.github/workflows/ci.yml@refs/heads/main",
      "eventName": "workflow_dispatch",
      "job": "fixed-mars-benchmark",
      "runId": "33074237426",
      "runAttempt": "1",
      "commitSha": "795628c2a9111f04761e054ad2d68cf88c786d71",
      "runnerEnvironment": "github-hosted",
      "runnerName": "GitHub Actions 1000000254",
      "runnerOs": "Linux",
      "runnerArch": "X64",
      "runUrl": "https://github.com/stone926/BUAA-CO-Toolkit/actions/runs/33074237426/attempts/1"
    }
  },
  "runnerFingerprint": "4acbdb014dec6f6c8c5282bf16f61a43e21e9ce45a6883796d9f44a8711f9048",
  "reference": {
    "role": "mars-assembler-v0.6.3",
    "fileName": "Mars_CO_v0.6.3.jar",
    "sha256": "599957c96b4e94c267a117d548eb5a1bd32d72d879a831a5f695a648c1eafb31",
    "sourceTag": "v0.6.3",
    "sourceCommit": "8b53a492dddc4fe1c62a7a02c55bea6fc4fb49d8"
  },
  "matrixSha256": "4ed8427c0c373c38ce3f9230639729b288210287b0ea520f697bdaa12c19a70b",
  "samplePolicy": {
    "independentSamplesPerCell": 7,
    "percentileMethod": "nearest-rank-v1",
    "confidenceInterval": "deterministic-bootstrap-95-v1"
  },
  "cells": [
    {
      "phase": "assembly",
      "workload": "plain",
      "profile": "P3",
      "memoryConfiguration": "FixedCompactLargeText",
      "traceMode": "off",
      "wordCount": 10,
      "requestedSteps": 32,
      "effectiveMaxSteps": 32,
      "lifecycle": "cold-end-to-end",
      "processModel": "fresh-jvm-per-sample",
      "cellId": "assembly:plain:off:10:32"
    },
    {
      "phase": "assembly",
      "workload": "plain",
      "profile": "P3",
      "memoryConfiguration": "FixedCompactLargeText",
      "traceMode": "off",
      "wordCount": 200,
      "requestedSteps": 32,
      "effectiveMaxSteps": 32,
      "lifecycle": "cold-end-to-end",
      "processModel": "fresh-jvm-per-sample",
      "cellId": "assembly:plain:off:200:32"
    },
    {
      "phase": "assembly",
      "workload": "plain",
      "profile": "P3",
      "memoryConfiguration": "FixedCompactLargeText",
      "traceMode": "off",
      "wordCount": 1000,
      "requestedSteps": 32,
      "effectiveMaxSteps": 32,
      "lifecycle": "cold-end-to-end",
      "processModel": "fresh-jvm-per-sample",
      "cellId": "assembly:plain:off:1000:32"
    },
    {
      "phase": "assembly",
      "workload": "plain",
      "profile": "P3",
      "memoryConfiguration": "Default",
      "traceMode": "off",
      "wordCount": 4096,
      "requestedSteps": 32,
      "effectiveMaxSteps": 32,
      "lifecycle": "cold-end-to-end",
      "processModel": "fresh-jvm-per-sample",
      "cellId": "assembly:plain:off:4096:32"
    },
    {
      "phase": "execution",
      "workload": "plain",
      "profile": "P6",
      "memoryConfiguration": "FixedCompactLargeText",
      "traceMode": "off",
      "wordCount": 200,
      "requestedSteps": 1000,
      "effectiveMaxSteps": 1000,
      "lifecycle": "cold-end-to-end",
      "processModel": "fresh-jvm-per-sample",
      "cellId": "execution:plain:off:200:1000"
    },
    {
      "phase": "execution",
      "workload": "plain",
      "profile": "P6",
      "memoryConfiguration": "FixedCompactLargeText",
      "traceMode": "off",
      "wordCount": 200,
      "requestedSteps": 65536,
      "effectiveMaxSteps": 65536,
      "lifecycle": "cold-end-to-end",
      "processModel": "fresh-jvm-per-sample",
      "cellId": "execution:plain:off:200:65536"
    },
    {
      "phase": "execution",
      "workload": "plain",
      "profile": "P6",
      "memoryConfiguration": "FixedCompactLargeText",
      "traceMode": "off",
      "wordCount": 200,
      "requestedSteps": 1000000,
      "effectiveMaxSteps": 1000000,
      "lifecycle": "cold-end-to-end",
      "processModel": "fresh-jvm-per-sample",
      "cellId": "execution:plain:off:200:1000000"
    },
    {
      "phase": "execution",
      "workload": "plain",
      "profile": "P6",
      "memoryConfiguration": "FixedCompactLargeText",
      "traceMode": "commit",
      "wordCount": 200,
      "requestedSteps": 1000,
      "effectiveMaxSteps": 1000,
      "lifecycle": "cold-end-to-end",
      "processModel": "fresh-jvm-per-sample",
      "cellId": "execution:plain:commit:200:1000"
    },
    {
      "phase": "execution",
      "workload": "plain",
      "profile": "P6",
      "memoryConfiguration": "FixedCompactLargeText",
      "traceMode": "commit",
      "wordCount": 200,
      "requestedSteps": 65536,
      "effectiveMaxSteps": 65536,
      "lifecycle": "cold-end-to-end",
      "processModel": "fresh-jvm-per-sample",
      "cellId": "execution:plain:commit:200:65536"
    },
    {
      "phase": "execution",
      "workload": "plain",
      "profile": "P6",
      "memoryConfiguration": "FixedCompactLargeText",
      "traceMode": "commit",
      "wordCount": 200,
      "requestedSteps": 1000000,
      "effectiveMaxSteps": 1000000,
      "lifecycle": "cold-end-to-end",
      "processModel": "fresh-jvm-per-sample",
      "cellId": "execution:plain:commit:200:1000000"
    },
    {
      "phase": "execution",
      "workload": "plain",
      "profile": "P6",
      "memoryConfiguration": "FixedCompactLargeText",
      "traceMode": "canonical-full",
      "wordCount": 200,
      "requestedSteps": 1000,
      "effectiveMaxSteps": 1000,
      "lifecycle": "cold-end-to-end",
      "processModel": "fresh-jvm-per-sample",
      "cellId": "execution:plain:canonical-full:200:1000"
    },
    {
      "phase": "execution",
      "workload": "plain",
      "profile": "P6",
      "memoryConfiguration": "FixedCompactLargeText",
      "traceMode": "canonical-full",
      "wordCount": 200,
      "requestedSteps": 65536,
      "effectiveMaxSteps": 65536,
      "lifecycle": "cold-end-to-end",
      "processModel": "fresh-jvm-per-sample",
      "cellId": "execution:plain:canonical-full:200:65536"
    },
    {
      "phase": "execution",
      "workload": "plain",
      "profile": "P6",
      "memoryConfiguration": "FixedCompactLargeText",
      "traceMode": "canonical-full",
      "wordCount": 200,
      "requestedSteps": 1000000,
      "effectiveMaxSteps": 1000000,
      "lifecycle": "cold-end-to-end",
      "processModel": "fresh-jvm-per-sample",
      "cellId": "execution:plain:canonical-full:200:1000000"
    },
    {
      "phase": "execution",
      "workload": "memory-intensive",
      "profile": "P6",
      "memoryConfiguration": "FixedCompactLargeText",
      "traceMode": "off",
      "wordCount": 200,
      "requestedSteps": 1000,
      "effectiveMaxSteps": 1000,
      "lifecycle": "cold-end-to-end",
      "processModel": "fresh-jvm-per-sample",
      "cellId": "execution:memory-intensive:off:200:1000"
    },
    {
      "phase": "execution",
      "workload": "memory-intensive",
      "profile": "P6",
      "memoryConfiguration": "FixedCompactLargeText",
      "traceMode": "off",
      "wordCount": 200,
      "requestedSteps": 65536,
      "effectiveMaxSteps": 65536,
      "lifecycle": "cold-end-to-end",
      "processModel": "fresh-jvm-per-sample",
      "cellId": "execution:memory-intensive:off:200:65536"
    },
    {
      "phase": "execution",
      "workload": "memory-intensive",
      "profile": "P6",
      "memoryConfiguration": "FixedCompactLargeText",
      "traceMode": "off",
      "wordCount": 200,
      "requestedSteps": 1000000,
      "effectiveMaxSteps": 1000000,
      "lifecycle": "cold-end-to-end",
      "processModel": "fresh-jvm-per-sample",
      "cellId": "execution:memory-intensive:off:200:1000000"
    },
    {
      "phase": "execution",
      "workload": "memory-intensive",
      "profile": "P6",
      "memoryConfiguration": "FixedCompactLargeText",
      "traceMode": "commit",
      "wordCount": 200,
      "requestedSteps": 1000,
      "effectiveMaxSteps": 1000,
      "lifecycle": "cold-end-to-end",
      "processModel": "fresh-jvm-per-sample",
      "cellId": "execution:memory-intensive:commit:200:1000"
    },
    {
      "phase": "execution",
      "workload": "memory-intensive",
      "profile": "P6",
      "memoryConfiguration": "FixedCompactLargeText",
      "traceMode": "commit",
      "wordCount": 200,
      "requestedSteps": 65536,
      "effectiveMaxSteps": 65536,
      "lifecycle": "cold-end-to-end",
      "processModel": "fresh-jvm-per-sample",
      "cellId": "execution:memory-intensive:commit:200:65536"
    },
    {
      "phase": "execution",
      "workload": "memory-intensive",
      "profile": "P6",
      "memoryConfiguration": "FixedCompactLargeText",
      "traceMode": "commit",
      "wordCount": 200,
      "requestedSteps": 1000000,
      "effectiveMaxSteps": 1000000,
      "lifecycle": "cold-end-to-end",
      "processModel": "fresh-jvm-per-sample",
      "cellId": "execution:memory-intensive:commit:200:1000000"
    },
    {
      "phase": "execution",
      "workload": "memory-intensive",
      "profile": "P6",
      "memoryConfiguration": "FixedCompactLargeText",
      "traceMode": "canonical-full",
      "wordCount": 200,
      "requestedSteps": 1000,